name;category;author;description;views;copies;link-href
Working Agreements;Gestión de equipos;por Atlassian Team Playbook;Create a list of expectations with your teammates for successful collaboration.;4,7 mil;671;https://trello.com/templates/team-management/working-agreements-sRdK1bCF
The PM Skills Assessment by Marty Cagan (SVPG.com);Gestión de productos;por Nurit Gazit, Senior Product Manager;Implement the PM Skills Assessment process from Silicon Valley Product Group.;5 mil;568;https://trello.com/templates/product-management/the-pm-skills-assessment-by-marty-cagan-(svpg.com)-RxEexasy
Grant Tracking Template;Negocio;por Shahzeb Irshad, Grants, Strategy and Project Management Specialist;Track grant funding opportunities for your non profit organization or social enterprise.;32,3 mil;5,4 mil;https://trello.com/templates/business/grant-tracking-template-GF6XHLuq
Town Hall Meetings;Negocio;por Trello Team;To facilitate the transparency of these meetings we created a Trello board that is open to everyone at the company.;60,1 mil;9,6 mil;https://trello.com/templates/business/town-hall-meetings-K0ZOiQ7U
Yoga Flow Creator;Para asuntos privados;por Jessie Maxwell, Edge Effect Media;Create yoga flows with this template chock full of visual pose cards!;6,6 mil;1,3 mil;https://trello.com/templates/personal/yoga-flow-creator-2ZqT7c8T
Design Sprint;Diseño;por Trello Design Team;Use this design sprint template to ideate on early concepts and test ideas out with customers.;145,9 mil;15,4 mil;https://trello.com/templates/design/design-sprint-6NanhvtF
Plan Your Life;Para asuntos privados;por Samantha Dee, Life Coach;Find your direction and commit to some life changes.;21,2 mil;5,9 mil;https://trello.com/templates/personal/plan-your-life-qH1ngXVo
Montessori Inspired Planning & Homeschool Education;Educación;por Bee, owner @ Puff Apothecary;Prepare for your home to become a Montessori inspired space.;5,8 mil;894;https://trello.com/templates/education/montessori-inspired-planning-&-homeschool-education-pgLQTNMN
Job Hunting Board;Para asuntos privados;por Balaji Srinivasan;Keep track of your job search, from applications to offers!;9,8 mil;3,9 mil;https://trello.com/templates/personal/job-hunting-board-SAAWwFDA
Homeschool Timetable;Educación;por Evelyn, New South Wales, Australia;Plan out activities and lessons for children learning from home.;29,7 mil;6 mil;https://trello.com/templates/education/homeschool-timetable-EAUxfvBQ
Weekly Classroom Newsletter;Educación;por Trello Team;Plan and communicate with your class parents using Trello!;38,8 mil;2,4 mil;https://trello.com/templates/education/weekly-classroom-newsletter-ALJlJokP
Recruiting Pipeline;RR. HH. y operaciones;por Trello Team;Manage your recruiting pipeline from anticipated future needs to closed positions. Get a scannable view of your recruiting pipeline by creating a card for each position. Save time by attaching job descriptions to each positions’ card so that they can be accessed and updated by anyone on the team. Streamline your process by creating copiable template cards with checklists for each step required to fill an open role.;12 mil;1,8 mil;https://trello.com/templates/operations-hr/recruiting-pipeline-uGtv1gr7
Bike Repair Pipeline;Ventas;por Heritage General Store;Track bike repair orders from start to finish with a Trello repair pipeline.;42,7 mil;1 mil;https://trello.com/templates/sales/bike-repair-pipeline-9clNtU6v
Life Watchers 2020;Productividad;por Cindy Duong, Senior Marketing Designer, Trello @ Atlassian;Stay accountable to your life goals with a team of trusted friends/advisors!;33,6 mil;5,7 mil;https://trello.com/templates/productivity/life-watchers-2020-caoEMy9D
Productivity Workflow;Productividad;por Trello Marketing Team;As a team we're always trying out new productivity methods, use this board to try each one!;144 mil;28,9 mil;https://trello.com/templates/productivity/productivity-workflow-2ydu8DKc
CRM Pipeline;Ventas;por Trello Team;Create a pipeline for managing incoming leads or requests that is adaptable to your team’s needs!;121 mil;24 mil;https://trello.com/templates/sales/crm-pipeline-lrAIa0JW
Daily Tasks Planner;Para asuntos privados;por Anurag, System Architect @ Dynasense Technologies;Declutter your life by using this simple & easy task management template.;63 mil;21,8 mil;https://trello.com/templates/personal/daily-tasks-planner-qhQ4j8bT
Timed Effort Planner;Productividad;por Mahesh Raju, Director of Technology @ Hyreo;Improve productivity by categorizing different tasks into different timed buckets.;28,6 mil;3,7 mil;https://trello.com/templates/productivity/timed-effort-planner-JLwlD7n3
Dream Builder Goals Template Board;Para asuntos privados;por Kasey Cooper, CEO/Life Coach;Effectively keep track of your goals and progress for each quarter.;13 mil;2,9 mil;https://trello.com/templates/personal/dream-builder-goals-template-board-41BsFLpq
Commission Queue for Artists;Para asuntos privados;por DerpyOlives, Artist;Keep track of your artist commissions while informing others of your progress.;2 mil;379;https://trello.com/templates/personal/commission-queue-for-artists-lhwwtQb6
Personal & Work Goals;Productividad;por David Barber, Blogger @ TechBarber.com;Track the status of your personal and professional productivity. Set goals and achieve them.;158,9 mil;25,2 mil;https://trello.com/templates/productivity/personal-&-work-goals-QvHVksDa
Project Management;Gestión de proyectos;por Trello Marketing Team;Use this basic structure to build your team's ideal workflow, for projects big or small.;793,3 mil;317,4 mil;https://trello.com/templates/project-management/project-management-1x4Uql2u
Teaching: Weekly Planning;Educación;por Emma Trentman, Associate Professor of Arabic @ University of New Mexico;A board per class. The lists are the weeks of the semester, cards are things I need to do for class each week.;103,4 mil;25,3 mil;https://trello.com/templates/education/teaching:-weekly-planning-tfI3gVjI
Team Icebreaker: Surviving the Apocalypse;Gestión de equipos;por Christopher Davis, Product Designer @ Trello;Try this fun icebreaker during team hangouts, offsites, and more!;17,4 mil;858;https://trello.com/templates/team-management/team-icebreaker:-surviving-the-apocalypse-P6BjcmDd
Academic Literature Review;Educación;por Ann Gillian Chu, PhD researcher @ the University of St. Andrews;Keep track of what you've read and your notes in one place for long writing projects, like dissertations.;7,4 mil;1,8 mil;https://trello.com/templates/education/academic-literature-review-UV8x4jC3
OKRs;Negocio;por Kevan Lee, VP of Marketing @ Buffer;Learn how Kevan Lee helps his team prioritize and plan by setting OKRs - objectives and key results.;159,6 mil;26,8 mil;https://trello.com/templates/business/okrs-ZE5BzGZD
Moving Plan;Para asuntos privados;por Emily Cnossen, MarTech Analyst @ SAP Concur;When my husband and I decided to move to a new state, I instantly knew we would need a Trello board.;20,6 mil;4,7 mil;https://trello.com/templates/personal/moving-plan-4rSaP4aZ
Scalify Marketing Process Template;Marketing;por Scalify;For small marketing teams who want to get things done better and faster!;15,5 mil;3,1 mil;https://trello.com/templates/marketing/scalify-marketing-process-template-fY9NzD9a
Government Program Management;Gestión de equipos;por Amy Campbell, Project Manager @ Government Business Results, LLC;A simple template that any program manager at a government agency can quickly customize.;685;63;https://trello.com/templates/team-management/government-program-management-XLTUEgov
Etsy Order Fulfillment;Ventas;por Nicole Smith, Owner of Yellow Bess;Easy order management with Trello + Etsy!;13,1 mil;2,3 mil;https://trello.com/templates/sales/etsy-order-fulfillment-GPYIQ8lm
Enterprise Feature Requests;Asistencia;por Kristen Habacht, Head of Enterprise Dev Reps @ Atlassian;It’s important to keep feedback from our clients in a centralized and visible place.;33,3 mil;1,4 mil;https://trello.com/templates/support/enterprise-feature-requests-ezWgKsol
Lifestyle Goals (Living Room Remodel);Para asuntos privados;por Brit + Co;Add cards to map out and plan your goals.;75,5 mil;7,8 mil;https://trello.com/templates/personal/lifestyle-goals-(living-room-remodel)-OjEtPqx6
Premortem;Gestión de proyectos;por Atlassian Team Playbook;Anticipate risks so you can solve for them while there's still time.;3,6 mil;436;https://trello.com/templates/project-management/premortem-OtqPUc50
Team Goal Setting Central;Negocio;por Trello Marketing Team;Keep execs and higher-ups happy with this clear and trackable goal setting process.;108 mil;29,3 mil;https://trello.com/templates/business/team-goal-setting-central-ry8F0DOb
Design System Checklist;Diseño;por Rahul JR, Senior Product Manager @ Zoho Corp;A design system unites product teams around a common visual language.;46 mil;6,1 mil;https://trello.com/templates/design/design-system-checklist-yZn5VFoN
Sprint Retrospectives;Ingeniería;por Trello Engineering Team;Replace whiteboards with Trello boards for more informative and accessible team retrospectives.;48,2 mil;11,4 mil;https://trello.com/templates/engineering/sprint-retrospectives-hkaQsLWx
Wedding Planning;Para asuntos privados;por Lauren Moon, Product Marketing @ Trello;This template has the master list of wedding-related tasks, broken down by how many months out you are from the big day.;55,5 mil;12,8 mil;https://trello.com/templates/personal/wedding-planning-JeOMdNMH
Academic Research Degree Application Tracker;Educación;por Ann Gillian Chu, PhD researcher @ the University of St. Andrews;Keep track of the many moving parts in the process of applying for a research degree position.;701;128;https://trello.com/templates/education/academic-research-degree-application-tracker-fwYBOH2a
Game Development;Ingeniería;por Alt F4;This is a template designed to help game developers organise their ideas and progress.;11,1 mil;3,3 mil;https://trello.com/templates/engineering/game-development-4dy5IBK1
IT Project Workflow;Gestión de proyectos;por Nicola Di Giorgio, IT Architect @ PREGIOTEK;Manage IT projects workflow and make issues and status more visible.;44,1 mil;6,5 mil;https://trello.com/templates/project-management/it-project-workflow-TcQNw7nZ
Photography Order Production Tracking;Diseño;por Jesse Starr, Owner @ Two Elk Studios;A template for tracking the production of photography orders and works.;3,4 mil;438;https://trello.com/templates/design/photography-order-production-tracking-6y4dKks4
Houseplant Tracking Template 🌱;Para asuntos privados;por Jennie Yip, Designer @ Atlassian;Use this template to track your houseplants by following their growth, care, and other details.;3,2 mil;751;https://trello.com/templates/personal/houseplant-tracking-template-%F0%9F%8C%B1-EkzpRHgz
8 Creative Habits;Productividad;por Cherry Jeffs, Creative Practice Coach + Mixed-media Artist;A proven framework for implementing crucial habits for a sustainable and productive creative practice!;42,9 mil;4,3 mil;https://trello.com/templates/productivity/8-creative-habits-L6SJcYm6
Milano by food;Para asuntos privados;por Lorenzo Allievi, Project Manager @ Eataly;An ongoing collection of my favorite cuisines and restaurants in Milan, Italy.;7,7 mil;466;https://trello.com/templates/personal/milano-by-food-jFa3vtof
Photography Session Workflow Tracking;Diseño;por Jesse Starr, Owner @ Two Elk Studios;Use this board to track your photography sessions once they have been booked, to have an overview of your workflow stages.;3,5 mil;618;https://trello.com/templates/design/photography-session-workflow-tracking-p4sQNTHx
Client Workflow Management;Gestión de proyectos;por Jordan L. Couch, Attorney @ Palace Law;Use a Trello board to go paperless while managing a client workflow.;71 mil;13 mil;https://trello.com/templates/project-management/client-workflow-management-GHFaoLVc
M&A Due Diligence Template;Negocio;por Jason Gibb, Chief Project Officer @ BNG Team;Manage the complexities of a merger / acquisition process.;12,9 mil;2,1 mil;https://trello.com/templates/business/m&a-due-diligence-template-sSnkevMW
Lesson Planning;Educación;por Trello Team;Use this Trello board to plan your lessons out in advance.;102,6 mil;9,8 mil;https://trello.com/templates/education/lesson-planning-SGCjQMxQ
Figuring Out Your Podcast Idea;Marketing;por Mark Campbell, co-founder @ Melville.app;The template breaks down what to consider when starting a podcast.;3,9 mil;795;https://trello.com/templates/marketing/figuring-out-your-podcast-idea-5Op3ahj7
Wellbeing Discussion Template;RR. HH. y operaciones;por David Ostberg, Dir. of People Science @ Culture Amp;Gauge the wellbeing of your team on a consistent basis with retrospective and ideation sessions.;5,8 mil;724;https://trello.com/templates/operations-hr/wellbeing-discussion-template-xhm9hn9W
Post A Job [Hiring Process];RR. HH. y operaciones;por Indeed;Keep your Indeed job postings organized and hire the best candidates possible.;10,4 mil;2,1 mil;https://trello.com/templates/operations-hr/post-a-job-[hiring-process]-FggEQHw1
Annual Life Goals & Planning;Productividad;por Chhin Sras, Freelancer @ Dragon Seal Studio;Lay out your yearly goals and track your accomplishments.;23,8 mil;5,2 mil;https://trello.com/templates/productivity/annual-life-goals-&-planning-ves3wHI2
Managing Translations;Gestión de proyectos;por Denise Shimoni, Localization Manager @ Trello;We translate Trello into 21 languages by following this localization process.;12,4 mil;1,5 mil;https://trello.com/templates/project-management/managing-translations-ePkNcvAX
Book Clubs;Para asuntos privados;por Brian Cervino, Product Marketing @ Trello;Keep your book club on the same page, vote on the book you're reading next!;50,1 mil;6,3 mil;https://trello.com/templates/personal/book-clubs-tP0ROvp8
Marketing Overview;Marketing;por Stella Garber, Head of Marketing @ Trello;Use this board to create a stronger sense of transparency within your marketing team and the company.;44,8 mil;8,3 mil;https://trello.com/templates/marketing/marketing-overview-VoJQd9UF
Research Iteration;Diseño;por Jessica Crabb, Product Designer @ Pivotal Labs;Set-up your user research plan from start to finish!;74,6 mil;9,5 mil;https://trello.com/templates/design/research-iteration-8t9qgmNz
Staff Scheduling;Gestión de equipos;por Katara Hofmann;Manage team schedules and shifts.;15,1 mil;2 mil;https://trello.com/templates/team-management/staff-scheduling-TAED4hrH
Lean Canvas;Negocio;por Syarfandi Achmad;Lean Canvas is a 1-page business plan template created by Ash Maurya that helps you deconstruct your idea into its key assumptions.;34 mil;6,6 mil;https://trello.com/templates/business/lean-canvas-YAmpiSeb
Personal (or Work) Productivity System - Know your Priorities;Productividad;por Rebecca Lossing, Product Manager;Use this template to maximize your productivity in a way that aligns with your real priorities.;34,2 mil;4,4 mil;https://trello.com/templates/productivity/personal-(or-work)-productivity-system---know-your-priorities-XkHwLSZQ
Inbound Marketing Campaign Template;Marketing;por Delilah Osborne, Marketing Director @ Rework;Get a full view of contents and assets when working on multiple integrated campaigns.;31,8 mil;7,4 mil;https://trello.com/templates/marketing/inbound-marketing-campaign-template-qwIlhmMV
Interview Study Tracker;Para asuntos privados;por Esco Obong, Senior Software Engineer @ Uber;Track your progress and keep organized when studying for job interviews.;16,2 mil;3,9 mil;https://trello.com/templates/personal/interview-study-tracker-5g9FvwSF
Setlist Organizer;Para asuntos privados;por Stu Smith, Designer @ Trello;Use this template to plan your band's upcoming gigs, store your chord charts, and everything your band needs to be successful.;5,7 mil;571;https://trello.com/templates/personal/setlist-organizer-E3s5vqAm
Simple Project Board;Gestión de proyectos;por David Mugisha, Senior AI Tech Delivery Analyst @ Accenture;Move projects through brainstorm, to do, doing, and done.;277,1 mil;96,6 mil;https://trello.com/templates/project-management/simple-project-board-6QW0Ciu8
Post-Mortem Meeting Board;Gestión de equipos;por Darren Chait, Co-Founder @ Hugo;This boards help you celebrate what worked and learn from what didn't.;6 mil;832;https://trello.com/templates/team-management/post-mortem-meeting-board-GZpNME7W
Podcast Workflow Template;Marketing;por Ryan Spilken, Evangelist @ Adaptavist;The one-stop-shop for managing your podcast production workflow.;1,4 mil;320;https://trello.com/templates/marketing/podcast-workflow-template-5boCNZwE
2020 Online Bullet Journal - BuJo;Productividad;por Nayara Soares, Brazil Country Manager @ MyHeritage;Get into bullet journaling without having to carry a notebook everywhere you go.;51 mil;9,5 mil;https://trello.com/templates/productivity/2020-online-bullet-journal---bujo-zL8W3v5V
Onboarding Process For New Hires;RR. HH. y operaciones;por InVision;Ensure that every new hire has a meaningful onboarding experience.;30,2 mil;4,2 mil;https://trello.com/templates/operations-hr/onboarding-process-for-new-hires-16LjOiG1
Decision Tracking Board;Negocio;por Darren Chait, Co-Founder @ Hugo;Keep your team aligned with a board dedicated to tracking the outcomes of decisions.;39,6 mil;4,8 mil;https://trello.com/templates/business/decision-tracking-board-g8vsbmEA
Business Tax Preparation Workflow;Gestión de proyectos;por CountingWorks PRO;Client management for CPAs, EAs, and Tax Professionals.;13,5 mil;2,5 mil;https://trello.com/templates/project-management/business-tax-preparation-workflow-cT1nvMpO
Research Project;Diseño;por Christopher Davis, Product Designer @ Trello;At Trello, research is fundamental to building great experiences.;44 mil;7,2 mil;https://trello.com/templates/design/research-project-DtCkfoiI
Customer Support Knowledge Base;Asistencia;por Lana Panchuk, Marketing Manager @ Futura Genetics;Streamlined communication between support and the Science Team. Support can easily find the information needed and submit a request to the Science Team in case there is a necessity.;13,4 mil;2,8 mil;https://trello.com/templates/support/customer-support-knowledge-base-1rz5Ctgi
Getting Things Done - GTD;Productividad;por Kelvin Baggs;An implementation of the GTD (Getting Things Done) methodology, by David Allen.;42,8 mil;11,1 mil;https://trello.com/templates/productivity/getting-things-done---gtd-Ui72QWNI
Mise-En-Place Personal Productivity System;Productividad;por Justin Gallagher, Head of Product Management @ Trello;Increase your productivity with this board that can be used every day.;137,1 mil;40,1 mil;https://trello.com/templates/productivity/mise-en-place-personal-productivity-system-fq9Flotk
Marc Andreesen Productivity System;Productividad;por Bryan Ye, Content Designer @ Atlassian;Make your own productivity system based on Marc Andreessen's personal method.;55,9 mil;13 mil;https://trello.com/templates/productivity/marc-andreesen-productivity-system-VOy8QVlg
Employee Manual;RR. HH. y operaciones;por Trello Team;Get your new hires up and running with this simple employee manual!;100,8 mil;8,8 mil;https://trello.com/templates/operations-hr/employee-manual-HbTEX5hb
Work request and intake process;Gestión de proyectos;por Derek Hamilton, Content Designer @ Trello;An easy and automated way for coworkers to request work from you.;16,6 mil;1,8 mil;https://trello.com/templates/project-management/work-request-and-intake-process-BGbKiKKA
Team Focus Board;Gestión de equipos;por Paul Trowsdale, Project Manager @ UK Cabinet Office;Make our weekly team meetings more visual and engaging when discussing what is important.;9,1 mil;1,8 mil;https://trello.com/templates/team-management/team-focus-board-ut2TuipL
Travel Planning Template;Para asuntos privados;por Kelvin Baggs, Travel Enthusiast;Plan your trip from start to finish.;10 mil;3,4 mil;https://trello.com/templates/personal/travel-planning-template-mHcawLin
Goal Setting Basics;Para asuntos privados;por Sam Gravener, Blogger @ Here I Mum Again;A simple introduction to Trello as well as an effective Goal Tracking System.;46,9 mil;11,4 mil;https://trello.com/templates/personal/goal-setting-basics-HEwcplGR
Android Developer Roadmap;Ingeniería;por Ahmed Adel, Senior Software Engineer @ Zendesk;A study guide for developing on Android.;15,3 mil;2,7 mil;https://trello.com/templates/engineering/android-developer-roadmap-fsc44tYh
HR Team Learning Tracker;RR. HH. y operaciones;por Grand Hyatt;A shared resource for the HR team to keep track of all of the courses they have completed.;17 mil;3,1 mil;https://trello.com/templates/operations-hr/hr-team-learning-tracker-Cl4iifhY
The Home Workout Organizer;Para asuntos privados;por JR Raphael, Founder/Author @ Android Intelligence;A great way to track and organize at-home workouts. Each column is broken out by type of exercise.;18,2 mil;2,3 mil;https://trello.com/templates/personal/the-home-workout-organizer-DCLBh3Go
Superpowers and Kryptonite Exercise;Gestión de equipos;por Trello Team;This is a great exercise for team offsites. Get to know your teammates' strengths and weaknesses, and build shared understanding and empathy.;4,4 mil;554;https://trello.com/templates/team-management/superpowers-and-kryptonite-exercise-tkraWISQ
Weekly Music Lesson Template;Educación;por Kyle McGowan, Owner @ Heartland Music Academy;For music instructors who teach an instrument online.;5,8 mil;1 mil;https://trello.com/templates/education/weekly-music-lesson-template-tze79Ve6
Reader Manager;Para asuntos privados;por Ian Kipchirchir;Keep track of what you've read, want to read, and suggestions from others.;4,3 mil;1,2 mil;https://trello.com/templates/personal/reader-manager-I5WZSJGa
Language Learning Template;Educación;por Damien Desmond;A comprehensive template for a self-instructed or class based curriculum for learning a new language.;8,5 mil;1,6 mil;https://trello.com/templates/education/language-learning-template-JM3h0RF0
Content Collection;Marketing;por Jayde Gillan, Founder @ Tara Buddha;Use a Trello board to keep a collection of draft content for social media purposes.;15,4 mil;3 mil;https://trello.com/templates/marketing/content-collection-SrQq3HbC
Self Care (Daily);Para asuntos privados;por Kate Conway, QA Manager, Atlassian;Stick to some self care activities for more energy throughout the day.;13,7 mil;2,7 mil;https://trello.com/templates/personal/self-care-(daily)-vKTnXm8V
Service Desk - Incident Impact Analysis;Asistencia;por Chris Christian, Major Incident Manager @ CSAA;Gather the key data around an incident to address it effectively.;5,3 mil;364;https://trello.com/templates/support/service-desk---incident-impact-analysis-GSJ9Vgm2
Creative Content Workflow;Marketing;por Gary Doublé, Director @ DevOwt Software Solutions Limited;Blogger, vLoggers, artists, content connoisseurs, this template makes managing your creative content delivery workflow super easy.;14,1 mil;4,3 mil;https://trello.com/templates/marketing/creative-content-workflow-4WWdXq6k
User Story Mapping Template;Gestión de productos;por Faris Han, Developer @ Hubton Indonesia;A template for mapping digital product's user stories with multiple user roles.;19,9 mil;2,5 mil;https://trello.com/templates/product-management/user-story-mapping-template-XVrmnTX3
Heuristic Evaluation;Diseño;por Tiffany Wang, Product Designer @ Trello;Use this board to conduct a heuristic evaluation of any UI projects your team is working on.;22,5 mil;3,5 mil;https://trello.com/templates/design/heuristic-evaluation-tlVIJm0l
Artist Commissions;Diseño;por Joey Myers Design, Freelancer;This board is for creative professionals who need a simple but effective workflow for client work.;11,8 mil;2,3 mil;https://trello.com/templates/design/artist-commissions-dJ1wZryE
White Elephant!;Para asuntos privados;por Natalie Mendes, Senior Content Marketing Manager @ Atlassian;Everyone's favorite holiday gift exchange game that can now be played virtually!;3,7 mil;340;https://trello.com/templates/personal/white-elephant!-ED47L26U
A Halloween Hiring & Recruiting;RR. HH. y operaciones;por Toni, Founder @ Crmble;A template with Power-Ups to help with hiring and recruiting.;11 mil;2,8 mil;https://trello.com/templates/operations-hr/a-halloween-hiring-&-recruiting-MVwm6SjI
Offsite Planning;Gestión de equipos;por Trello Team;Use this template to plan your next team offsite! The whole team has access to this board before, during, and after the offsite to stay informed.;10 mil;1,4 mil;https://trello.com/templates/team-management/offsite-planning-QFFN55LD
Team Retrospectives With Post-itⓇ + Trello;Gestión de equipos;por Andrew C. Hyde, Marketing Manager @ 3M;Gather your team together and put those Post-itⓇ Super Sticky Notes to work with Trello!;49,2 mil;9,6 mil;https://trello.com/templates/team-management/team-retrospectives-with-post-it%E2%93%A1-+-trello-GXmrfRXA
Retail Sales Pipeline;Ventas;por Mike's Bikes;We use this retail sales pipeline to manage orders across 12 retail shops.;18,7 mil;2,4 mil;https://trello.com/templates/sales/retail-sales-pipeline-aVPCG2i0
Remote Team Meetings;Trabajo a distancia;por Trello Team;Bring focus and transparency to your remote team meetings.;56,6 mil;11,6 mil;https://trello.com/templates/remote-work/remote-team-meetings-lYdxML7x
Interior Design Order Tracking;Diseño;por Maria Martin, Founder @ Design Appy;Easily place and track orders for your interior design projects.;40,7 mil;5,6 mil;https://trello.com/templates/design/interior-design-order-tracking-MT8OMgny
