name;category;author;description;views;copies;link-href
5 Product Management Buckets;Gestión de productos;por Zoho Desk;We manage product management tasks by splitting the work into 5 different buckets.;54,5 mil;11,4 mil;https://trello.com/templates/product-management/5-product-management-buckets-H8rDCB7e
Marketing Requests;Marketing;por Chad Reid, VP of Marketing and Communications @ JotForm;This board is a collaboration board between the JotForm marketing and growth teams.;33,8 mil;8 mil;https://trello.com/templates/marketing/marketing-requests-FK3MvDhj
Team Organization Central;Gestión de equipos;por Trello Marketing Team;Store all essential team resources, schedules, project summaries, updates and more.;63,3 mil;14,9 mil;https://trello.com/templates/team-management/team-organization-central-ANpOpyQQ
Remote Cooking Challenge;Para asuntos privados;por Alexia Ohannessian, PMM @ Trello;Help your team or friend group bond from afar with the remote cooking challenge!;5,2 mil;1,1 mil;https://trello.com/templates/personal/remote-cooking-challenge-BtoZL0AQ
Project Based Learning;Educación;por Michael Burke, Educator @ Bel Air High School;A key aspect of organizing projects is creating a timeline, responsibilities, and checklists.;110,7 mil;14,4 mil;https://trello.com/templates/education/project-based-learning-suSC9geN
Agile Board;Gestión de proyectos;por Lyndi Thompson, Sr. Demand Generation Manager @ Accolade Health;Getting things done is a process: it’s a way of thinking that involves planning, execution, iteration, and reflection.;463,9 mil;78,5 mil;https://trello.com/templates/project-management/agile-board-DnZvFigA
Travel Packing Checklist;Para asuntos privados;por Kelvin Baggs, Travel Enthusiast;Ensure you pack everything for your perfect vacation.;8,1 mil;2,8 mil;https://trello.com/templates/personal/travel-packing-checklist-EDzslHaL
Blog Content Schedule;Marketing;por Scan2CAD;A scheduled pipeline of all upcoming and published content for your blog.;46,8 mil;13,3 mil;https://trello.com/templates/marketing/blog-content-schedule-Y84uxh4d
Freelance Branding Project;Diseño;por Stu Smith, Designer @ Trello;Use this template to run your next Branding project.;37,7 mil;9,3 mil;https://trello.com/templates/design/freelance-branding-project-Z5m66HsJ
Marketing Master Editorial Calendar;Marketing;por  Tanushree Shenvi, Marketing Manager @ CleverTap;This master content calendar helps us track content across a geographically distributed team.;34 mil;8,4 mil;https://trello.com/templates/marketing/marketing-master-editorial-calendar-VyMRBl37
Writing A Book;Para asuntos privados;por Rani Shah, Content & Social Media Manager @ Trello;Whether it's an epic novel or a children's book, we've got you covered with a template that can help you along your literary journey.;18,1 mil;5,4 mil;https://trello.com/templates/personal/writing-a-book-XAOC4oWL
Office Party Planning;Gestión de equipos;por Trello Marketing Team;Use this Trello board to plan an amazing office party!;23,1 mil;7,6 mil;https://trello.com/templates/team-management/office-party-planning-NKALXvqK
1-on-1 Meeting Agenda;Gestión de equipos;por Sarah Goff-Dupont, Principal Writer @ Atlassian;This board keeps myself and my direct reports on the same page.;63,9 mil;18,1 mil;https://trello.com/templates/team-management/1-on-1-meeting-agenda-FoIwUPz2
Character Setup;Diseño;por Pearl, Writer;A template for writers to setup the characters of your stories in order and make distinguishing characteristics obvious.;8,3 mil;1,8 mil;https://trello.com/templates/design/character-setup-zWwc4Zlj
Government Project Management;Gestión de proyectos;por Amy Campbell, Project Manager @ Government Business Results, LLC;Use this visual tool to bust down team silos and make it easy to collaborate and get more done.;17,9 mil;4,2 mil;https://trello.com/templates/project-management/government-project-management-RKahFXJq
Syllabus Template;Educación;por C. Wess Daniels, Director @ Guilford College;Using Trello allows my students to participate in the actual development of the content within the syllabus.;43,6 mil;4,9 mil;https://trello.com/templates/education/syllabus-template-MEj9Q6SK
Groceries Template;Para asuntos privados;por Crux, a guy who loves lists.;A basic groceries template that you can slide items around.;7,9 mil;2,3 mil;https://trello.com/templates/personal/groceries-template-lBAZ2RWP
Team Health Monitor;Gestión de equipos;por Atlassian Team Playbook;Assess your team against the eight attributes most commonly found among healthy teams.;9,7 mil;1,1 mil;https://trello.com/templates/team-management/team-health-monitor-X9Fjlh8H
Program Management Template;Gestión de proyectos;por Soniya Ahuja, Staff Program Manager @ Broadcom;A simple template with valuable links to resources that will help program managers quickly bootstrap the PMO team.;65,5 mil;7,8 mil;https://trello.com/templates/project-management/program-management-template-potjK48u
Reading List;Para asuntos privados;por Vijay Chahal, Digital Transformation Lead;A visual way to keep track of the books you want to read.;8,3 mil;2,8 mil;https://trello.com/templates/personal/reading-list-sy79W3jy
Work From Home Daily Planner;Trabajo a distancia;por Sarah Costello @ TalentHub;Plan, collaborate and monitor your work-from-home schedule.;67,7 mil;25,7 mil;https://trello.com/templates/remote-work/work-from-home-daily-planner-5sRDk17I
Collaboration Board;Gestión de equipos;por Diane B.;A helpful template for collaborating with teams on projects.;25,9 mil;5,3 mil;https://trello.com/templates/team-management/collaboration-board-CETImW5j
Budget Template;Para asuntos privados;por Cedrik Bell, budget extraordinaire;Track monthly expenses and recurring charges.;33 mil;8,4 mil;https://trello.com/templates/personal/budget-template-VhDsuy74
Homeschool Trello Template;Educación;por Amalia Anwar, Customer Success Manager @ Atlassian;A template for homeschooling with goals for the day, school assignments, fun activities, and chores.;56,2 mil;14 mil;https://trello.com/templates/education/homeschool-trello-template-rzV6j90U
